{
  "schema_version": "uaa-social-foundation-promotion.v1",
  "ledger_ref": "ledger-ref:social-read-only-foundation-promotion:v1",
  "profile_ref": "contract-ref:social-read-only-foundation-profile:v1",
  "candidate_author_ref": "author-ref:social-foundation:q25-candidate",
  "acceptance_subject_digest": "sha256:66f1ce39403e8e9ff3c9c0b6a4c80b90620a8dd1293069b07e04a4039b832761",
  "subject_files": [
    {"path_ref": "repo-path-ref:apps/control-center/src/App.test.tsx", "sha256": "sha256:4c154fd52102050991a4c1f93a561130c4aba071314d101403d9483ccfead8bd"},
    {"path_ref": "repo-path-ref:apps/control-center/src/api/client.summaryEndpoints.test.ts", "sha256": "sha256:b7288c7e1f21b14e04169c0713ae6ded5da375185ff121cae952d27aa1ad0558"},
    {"path_ref": "repo-path-ref:apps/control-center/src/api/client.ts", "sha256": "sha256:d3152968b93a3c68aadd81893351d4067e3883da1904d061de69ba2a6f2888c2"},
    {"path_ref": "repo-path-ref:apps/control-center/src/api/types.ts", "sha256": "sha256:257ac0549fd65b797d260d551917c590e746c129c14ef0066c769f7e51e825e3"},
    {"path_ref": "repo-path-ref:apps/control-center/src/mocks/controlCenterData.ts", "sha256": "sha256:c7189063086205639bc176c8cce5406701cb5de65cc75cfcffa2c552c3a279c0"},
    {"path_ref": "repo-path-ref:apps/control-center/src/northstar/PrimarySurfaces.tsx", "sha256": "sha256:ea6d581c604e9a4439ae1bb30929c6bedaccbce76e622b086e3c2722a1c2b5ac"},
    {"path_ref": "repo-path-ref:apps/control-center/src/northstar/northStar.css", "sha256": "sha256:b8300001bbfa4afd5e65f6f22be310e6277b76930b9972431586c9817daa0e82"},
    {"path_ref": "repo-path-ref:apps/control-center/src/northstar/WiredSurfaces.test.tsx", "sha256": "sha256:120b985d188dc0a89d478e43bc23d2d1dedcf672eb7f222aa327b0a4e9c2ef7b"},
    {"path_ref": "repo-path-ref:apps/control-center/tests/visual/foundation-surfaces.real.spec.ts", "sha256": "sha256:36bc4697e98b6f2372def140a17ce8d5bbbb29d5bee6c52ce9b7334030df81d7"},
    {"path_ref": "repo-path-ref:apps/control-center/tests/visual/__snapshots__/desktop/crm.png", "sha256": "sha256:3abe5e74e143f3acba688fc155abd07256926d7a5e697fd352bbe70b169a57a8"},
    {"path_ref": "repo-path-ref:apps/control-center/tests/visual/__snapshots__/mobile/crm.png", "sha256": "sha256:5521b0ddcc86c883ade4542069ae5291a6b69cb151a9408e13d3740dd951c3fe"},
    {"path_ref": "repo-path-ref:docs/control_center/visual_regression_manifest.json", "sha256": "sha256:5f3ee57dd2549e783404f3a3f3b9c2e6c3b9e6c7b503a88c8c3fec4e8e2ca148"},
    {"path_ref": "repo-path-ref:docs/product/UAA_PRIVATE_DOGFOOD_DIRECTION_ACCEPTANCE.md", "sha256": "sha256:66b671b5e7fa36da62d26b9860d74d1097d861fa56a659b35c6d28a6f5085232"},
    {"path_ref": "repo-path-ref:docs/product/UAA_SOCIAL_READ_ONLY_FOUNDATION_PROFILE.md", "sha256": "sha256:5bd0647d677cc41c9676a65b332730fe57ef81023cbe8134010d53720ae67581"},
    {"path_ref": "repo-path-ref:docs/schemas/social_read_only_foundation_promotion_v1.schema.json", "sha256": "sha256:e1ebede628466ff0c80400c86ab83d2cd4fda9712c7c3d476d61ce8c20617eb8"},
    {"path_ref": "repo-path-ref:scripts/dev/uaa_crm.py", "sha256": "sha256:3f7813f1bf01de4c0f288d97eec1e405df93a4bb679d68928f6053f06fddf63c"},
    {"path_ref": "repo-path-ref:scripts/verify_social_read_only_foundation_profile.py", "sha256": "sha256:1a67ad47a8a7b5e3c84c1d0da89b37f7a9f8dedc46491a5b93770c998ee0a624"},
    {"path_ref": "repo-path-ref:src/ultimate_ai_agent/api/control_center.py", "sha256": "sha256:8f130370e9dc9dbf234468af9c54518b42eaf739a2ecb0b9bfd9e703b483b3ab"},
    {"path_ref": "repo-path-ref:src/ultimate_ai_agent/core/authority/contracts.py", "sha256": "sha256:568b1db50b0c2556e1684ab5c2e1273ef70487e449e368653cb722163d1cc25f"},
    {"path_ref": "repo-path-ref:src/ultimate_ai_agent/core/communications/contracts.py", "sha256": "sha256:f75bc82168a52a4379dd86a31dbff995773bdb993cc52494e29bae82201bdba6"},
    {"path_ref": "repo-path-ref:src/ultimate_ai_agent/core/communications/local_projection.py", "sha256": "sha256:b8ae7e153d396d8f99943403d6d2220a6c8e13a6a9b1d53716377ae46dd83cb6"},
    {"path_ref": "repo-path-ref:src/ultimate_ai_agent/core/control_center/work_board.py", "sha256": "sha256:297939bc32308ce5b30fa8685d3cab33029a6789470d236e47e996f3d18a8d1f"},
    {"path_ref": "repo-path-ref:src/ultimate_ai_agent/core/crm/__init__.py", "sha256": "sha256:b50c3f6004f63f93602fe952789725523e54f96c5115bebe220ddcba8981a428"},
    {"path_ref": "repo-path-ref:src/ultimate_ai_agent/core/crm/local_command_center.py", "sha256": "sha256:61bdfbfbc3ffc8d43dd194c17f6e4d10da175f1de39506b1ff2b13a7895484db"},
    {"path_ref": "repo-path-ref:src/ultimate_ai_agent/core/crm/social_projection.py", "sha256": "sha256:ee09732df27b28554dbaf3c69e19432cc53e283a75bdb51dac88316cc3387cef"},
    {"path_ref": "repo-path-ref:tests/test_communications_reviewed_projection.py", "sha256": "sha256:357f219bd055dba8084145540dd1c7a2d343b6a11dd17ecdb20ab6c5c1d5395d"},
    {"path_ref": "repo-path-ref:tests/test_control_center_work_board.py", "sha256": "sha256:36eb4c1102a083a924cc97bfb7b8bf8ee3eeaf3aee032a3359e72ed225669347"},
    {"path_ref": "repo-path-ref:tests/test_crm_local_command_center.py", "sha256": "sha256:8ae8091f897bf1e674bd44698a39ed2f5088e0c3dda21005bf1401cb1aea247d"},
    {"path_ref": "repo-path-ref:tests/test_crm_local_command_center_api_routes.py", "sha256": "sha256:f13a1a0f16bc0f6ed65a9ca2302509919e8b88c76ca37873bfc4bdec11766df6"},
    {"path_ref": "repo-path-ref:tests/test_social_read_only_foundation_profile.py", "sha256": "sha256:ab12af6cb87ea65f3e6d7fbb1b3d56eea83c70342a90f90eef0355cf81565be7"}
  ],
  "foundations": [
    {
      "foundation_ref": "foundation-ref:social-profile:work-board",
      "owner_ref": "owner-ref:work-board",
      "contract_ref": "contract-ref:work-board-social-content-saved-projection:v1",
      "implementation_state": "implemented",
      "path_refs": [
        "repo-path-ref:src/ultimate_ai_agent/core/control_center/work_board.py",
        "repo-path-ref:tests/test_control_center_work_board.py"
      ],
      "api_refs": ["GET /control-center/work-board"],
      "cli_refs": ["repo-local-command:uaa-work-board:inspect-board"],
      "ui_refs": ["control-center-surface-ref:work-board-social-content"],
      "verifier_refs": ["verifier-ref:social-foundation:work-board"],
      "evidence_refs": ["evidence-ref:social-foundation:work-board-owner-projection"]
    },
    {
      "foundation_ref": "foundation-ref:social-profile:communications",
      "owner_ref": "owner-ref:communications",
      "contract_ref": "contract-ref:communications-reviewed-projection:v1",
      "implementation_state": "implemented",
      "path_refs": [
        "repo-path-ref:src/ultimate_ai_agent/core/communications/contracts.py",
        "repo-path-ref:src/ultimate_ai_agent/core/communications/local_projection.py",
        "repo-path-ref:tests/test_communications_reviewed_projection.py"
      ],
      "api_refs": [
        "GET /control-center/communications/conversations",
        "GET /control-center/communications/conversations/{conversation_ref}"
      ],
      "cli_refs": ["repo-local-command:uaa-communications:conversations"],
      "ui_refs": ["control-center-surface-ref:communications-social-media"],
      "verifier_refs": ["verifier-ref:social-foundation:communications"],
      "evidence_refs": ["evidence-ref:social-foundation:communications-owner-projection"]
    },
    {
      "foundation_ref": "foundation-ref:social-profile:crm",
      "owner_ref": "owner-ref:crm",
      "contract_ref": "contract-ref:crm-social-relationship-projection:v1",
      "implementation_state": "implemented",
      "path_refs": [
        "repo-path-ref:apps/control-center/src/App.test.tsx",
        "repo-path-ref:apps/control-center/src/api/client.summaryEndpoints.test.ts",
        "repo-path-ref:apps/control-center/src/api/client.ts",
        "repo-path-ref:apps/control-center/src/api/types.ts",
        "repo-path-ref:apps/control-center/src/mocks/controlCenterData.ts",
        "repo-path-ref:apps/control-center/src/northstar/PrimarySurfaces.tsx",
        "repo-path-ref:apps/control-center/src/northstar/northStar.css",
        "repo-path-ref:apps/control-center/src/northstar/WiredSurfaces.test.tsx",
        "repo-path-ref:apps/control-center/tests/visual/foundation-surfaces.real.spec.ts",
        "repo-path-ref:apps/control-center/tests/visual/__snapshots__/desktop/crm.png",
        "repo-path-ref:apps/control-center/tests/visual/__snapshots__/mobile/crm.png",
        "repo-path-ref:docs/control_center/visual_regression_manifest.json",
        "repo-path-ref:scripts/dev/uaa_crm.py",
        "repo-path-ref:src/ultimate_ai_agent/api/control_center.py",
        "repo-path-ref:src/ultimate_ai_agent/core/authority/contracts.py",
        "repo-path-ref:src/ultimate_ai_agent/core/crm/__init__.py",
        "repo-path-ref:src/ultimate_ai_agent/core/crm/local_command_center.py",
        "repo-path-ref:src/ultimate_ai_agent/core/crm/social_projection.py",
        "repo-path-ref:tests/test_crm_local_command_center.py",
        "repo-path-ref:tests/test_crm_local_command_center_api_routes.py",
        "repo-path-ref:tests/test_social_read_only_foundation_profile.py"
      ],
      "api_refs": ["GET /control-center/crm/relationships"],
      "cli_refs": [
        "repo-local-command:uaa-crm:inspect-social-relationships",
        "repo-local-command:uaa-crm:mutate-local"
      ],
      "ui_refs": ["control-center-surface-ref:crm-social-relationship-context"],
      "verifier_refs": ["verifier-ref:social-foundation:crm"],
      "evidence_refs": ["evidence-ref:social-foundation:crm-owner-projection"]
    },
    {
      "foundation_ref": "foundation-ref:social-profile:promotion-contract",
      "owner_ref": "owner-ref:governance",
      "contract_ref": "contract-ref:social-read-only-foundation-profile:v1",
      "implementation_state": "implemented",
      "path_refs": [
        "repo-path-ref:docs/product/UAA_PRIVATE_DOGFOOD_DIRECTION_ACCEPTANCE.md",